{
  "$schema": "http://adaptivecards.io/schemas/adaptive-card.json",
  "type": "AdaptiveCard",
  "version": "1.6",
  "body": [
    {
      "type": "TextBlock",
      "text": "Premium App Card",
      "wrap": true
    }
  ],
  "actions": [
    {
      "type": "Action.Execute",
      "title": "Premium Action",
      "verb": "premium",
      "data": {
        "invocationId": "123"
      }
    }
  ]
}
