{
  "$schema": "http://adaptivecards.io/schemas/adaptive-card.json",
  "type": "AdaptiveCard",
  "version": "1.6",
  "body": [
    { "type": "TextBlock", "text": "Primary card" }
  ],
  "actions": [
    {
      "type": "Action.ShowCard",
      "title": "More",
      "card": {
        "type": "AdaptiveCard",
        "version": "1.6",
        "body": [
          { "type": "TextBlock", "text": "Nested card" }
        ]
      }
    }
  ]
}
