{
  "$schema": "http://adaptivecards.io/schemas/adaptive-card.json",
  "type": "AdaptiveCard",
  "version": "1.6",
  "body": [
    {
      "type": "Input.Text",
      "id": "answer",
      "label": "Your answer",
      "isRequired": true
    }
  ],
  "actions": [
    { "type": "Action.Submit", "title": "Send" }
  ]
}
