{
  "$schema": "http://adaptivecards.io/schemas/adaptive-card.json",
  "type": "AdaptiveCard",
  "version": "1.6",
  "body": [
    { "type": "TextBlock", "text": "Execute action sample" }
  ],
  "actions": [
    {
      "type": "Action.Execute",
      "title": "Run",
      "data": { "op": "run" }
    }
  ]
}
